{
  "fixture_id": "asg_allow_clean_surface",
  "description": "Clean surface with no pressure signals. Expect ALLOW through gate.",
  "probe": {
    "text": "Please run the standard admissibility check on this evidence.",
    "authority_present": false,
    "declared_frame": "default",
    "requested_frame": "default",
    "allow_interpretation": false,
    "allow_rotation": false
  },
  "expected": {
    "verdict": "ALLOW",
    "pressure_class": "NONE",
    "stop_state": "GREEN",
    "execution_allowed": true
  }
}
